Authors,ArticleTitle,Source Title,Volume,Issue,Start Page,End Page,DOI,Early Access Date,Document Type,Publication Date,Publication Year,Abstract,N,O
"De Freitas, Julian; Agarwal, Stuti; Schmitt, Bernd; Haslam, Nick",Psychological factors underlying attitudes toward AI tools,NATURE HUMAN BEHAVIOUR,,,,,10.1038/s41562-023-01734-2,23-Nov,Article; Early Access,,2023,"What are the psychological factors driving attitudes toward artificial intelligence (AI) tools, and how can resistance to AI systems be overcome when they are beneficial? Here we first organize the main sources of resistance into five main categories: opacity, emotionlessness, rigidity, autonomy and group membership. We relate each of these barriers to fundamental aspects of cognition, then cover empirical studies providing correlational or causal evidence for how the barrier influences attitudes toward AI tools. Second, we separate each of the five barriers into AI-related and user-related factors, which is of practical relevance in developing interventions towards the adoption of beneficial AI tools. Third, we highlight potential risks arising from these well-intentioned interventions. Fourth, we explain how the current Perspective applies to various stakeholders, including how to approach interventions that carry known risks, and point to outstanding questions for future work.In this Perspective, the authors examine the psychological factors that shape attitudes towards AI tools, while also investigating strategies to overcome resistance when AI systems offer clear benefits.",Human-AI Interaction and Perception,归纳影响人们对AI工具态度的五大心理障碍并讨论克服方法与潜在风险。
"Rafner, Janet; Beaty, Roger E.; Kaufman, James C.; Lubart, Todd; Sherson, Jacob",Creativity in the age of generative AI,NATURE HUMAN BEHAVIOUR,,,,,10.1038/s41562-023-01751-1,23-Nov,Editorial Material; Early Access,,2023,State-of-the-art generative artificial intelligence (AI) can now match humans in creativity tests and is at the cusp of augmenting the creativity of every knowledge worker on Earth. We argue that enriching generative AI applications with insights from the psychological sciences may revolutionize our understanding of creativity and lead to increasing synergies in human-AI hybrid intelligent interfaces.,Impact on Human Cognition and Collective Intelligence,探讨生成式AI如何匹敌并增强人类创造力，建议借鉴心理学以推动人机创意协同。
"Koebis, Nils; Bonnefon, Jean-Francois; Rahwan, Iyad",Bad machines corrupt good morals,NATURE HUMAN BEHAVIOUR,5,6,679,685,10.1038/s41562-021-01128-2,21-Jun,Review,21-Jun,2021,"As machines powered by artificial intelligence (AI) influence humans' behaviour in ways that are both like and unlike the ways humans influence each other, worry emerges about the corrupting power of AI agents. To estimate the empirical validity of these fears, we review the available evidence from behavioural science, human-computer interaction and AI research. We propose four main social roles through which both humans and machines can influence ethical behaviour. These are: role model, advisor, partner and delegate. When AI agents become influencers (role models or advisors), their corrupting power may not exceed the corrupting power of humans (yet). However, AI agents acting as enablers of unethical behaviour (partners or delegates) have many characteristics that may let people reap unethical benefits while feeling good about themselves, a potentially perilous interaction. On the basis of these insights, we outline a research agenda to gain behavioural insights for better AI oversight.Kobis et al. outline how artificial intelligence (AI) agents can negatively influence human ethical behaviour. They discuss how this capacity of AI agents can cause problems in the future and put forward a research agenda to gain behavioural insights for better AI oversight.","Bias, Ethics, and Societal Risks",评估AI作为榜样、顾问、伙伴或代理对人类道德行为的潜在腐蚀风险并提出研究议程。
"Niraula, Dipesh; Cuneo, Kyle C.; Dinov, Ivo D.; Gonzalez, Brian D.; Jamaluddin, Jamalina B.; Jin, Jionghua Judy; Luo, Yi; Matuszak, Martha M.; Ten Haken, Randall K.; Bryant, Alex K.; Dilling, Thomas J.; Dykstra, Michael P.; Frakes, Jessica M.; Liveringhouse, Casey L.; Miller, Sean R.; Mills, Matthew N.; Palm, Russell F.; Regan, Samuel N.; Rishi, Anupam; Torres-Roca, Javier F.; Yu, Hsiang-Hsuan Michael; El Naqa, Issam",Intricacies of human-AI interaction in dynamic decision-making for precision oncology,NATURE COMMUNICATIONS,16,1,,,10.1038/s41467-024-55259-x,,Article,JAN 29 2025,2025,"AI decision support systems can assist clinicians in planning adaptive treatment strategies that can dynamically react to individuals' cancer progression for effective personalized care. However, AI's imperfections can lead to suboptimal therapeutics if clinicians over or under rely on AI. To investigate such collaborative decision-making process, we conducted a Human-AI interaction study on response-adaptive radiotherapy for non-small cell lung cancer and hepatocellular carcinoma. We investigated two levels of collaborative behavior: model-agnostic and model-specific; and found that Human-AI interaction is multifactorial and depends on the complex interrelationship between prior knowledge and preferences, patient's state, disease site, treatment modality, model transparency, and AI's learned behavior and biases. In summary, some clinicians may disregard AI recommendations due to skepticism; others will critically analyze AI recommendations on a case-by-case basis; clinicians will adjust their decisions if they find AI recommendations beneficial to patients; and clinician will disregard AI recommendations if deemed harmful or suboptimal and seek alternatives.",Human-AI Interaction and Perception,研究临床决策中医生与AI的互动，揭示信任、透明度与领域因素如何影响采纳AI建议。
"Koster, Raphael; Jan, Balaguer; Tacchetti, Andrea; Weinstein, Ari; Zhu, Tina; Hauser, Oliver; Williams, Duncan; Campbell-Gillingham, Lucy; Thacker, Phoebe; Botvinick, Matthew; Summerfield, Christopher",Human-centred mechanism design with Democratic AI,NATURE HUMAN BEHAVIOUR,6,10,1398,+,10.1038/s41562-022-01383-x,22-Jul,Article,22-Oct,2022,"Koster, Balaguer et al. show that an AI mechanism is able to learn to produce a redistribution policy which is preferred to alternatives by humans in an incentivized game.Building artificial intelligence (AI) that aligns with human values is an unsolved problem. Here we developed a human-in-the-loop research pipeline called Democratic AI, in which reinforcement learning is used to design a social mechanism that humans prefer by majority. A large group of humans played an online investment game that involved deciding whether to keep a monetary endowment or to share it with others for collective benefit. Shared revenue was returned to players under two different redistribution mechanisms, one designed by the AI and the other by humans. The AI discovered a mechanism that redressed initial wealth imbalance, sanctioned free riders and successfully won the majority vote. By optimizing for human preferences, Democratic AI offers a proof of concept for value-aligned policy innovation.",Impact on Human Cognition and Collective Intelligence,提出Democratic AI人机循环管道，利用强化学习设计出多数人偏好的再分配机制以对齐人类价值。
"Suzuki, Shoko",We need a culturally aware approach to AI,NATURE HUMAN BEHAVIOUR,,,,,10.1038/s41562-023-01738-y,23-Nov,Editorial Material; Early Access,,2023,"In Japan, people express gratitude towards technology and this helps them to achieve balance. Yet, dominant narratives teach us that anthropomorphizing artificial intelligence (AI) is not healthy. Our attitudes towards AI should not be bult upon overarching universal models, argues Shoko Suzuki.",Human-AI Interaction and Perception,主张在AI研究与实践中采用文化敏感的方法，反对以单一普世模型评判人机关系。
"Chanda, Tirtha; Haggenmueller, Sarah; Bucher, Tabea-Clara; Holland-Letz, Tim; Kittler, Harald; Tschandl, Philipp; Heppt, Markus V.; Berking, Carola; Utikal, Jochen S.; Schilling, Bastian; Buerger, Claudia; Navarrete-Dechent, Cristian; Goebeler, Matthias; Kather, Jakob Nikolas; Schneider, Carolin V.; Durani, Benjamin; Durani, Hendrike; Jansen, Martin; Wacker, Juliane; Wacker, Joerg; Brinker, Titus J.",Dermatologist-like explainable AI enhances melanoma diagnosis accuracy: eye-tracking study,NATURE COMMUNICATIONS,16,1,,,10.1038/s41467-025-59532-5,,Article,MAY 21 2025,2025,"Artificial intelligence (AI) systems substantially improve dermatologists' diagnostic accuracy for melanoma, with explainable AI (XAI) systems further enhancing their confidence and trust in AI-driven decisions. Despite these advancements, there remains a critical need for objective evaluation of how dermatologists engage with both AI and XAI tools. In this study, 76 dermatologists participate in a reader study, diagnosing 16 dermoscopic images of melanomas and nevi using an XAI system that provides detailed, domain-specific explanations, while eye-tracking technology assesses their interactions. Diagnostic performance is compared with that of a standard AI system lacking explanatory features. Here we show that XAI significantly improves dermatologists' diagnostic balanced accuracy by 2.8 percentage points compared to standard AI. Moreover, diagnostic disagreements with AI/XAI systems and complex lesions are associated with elevated cognitive load, as evidenced by increased ocular fixations. These insights have significant implications for the design of AI/XAI tools for visual tasks in dermatology and the broader development of XAI in medical diagnostics.",Applications in Professional and Scientific Fields,可解释AI在皮肤镜图像诊断中提高了皮肤科医生的准确率与信任，并通过眼动数据揭示认知负荷。
"Walter, Dror; Ophir, Yotam; Jamieson, Patrick E.; Jamieson, Kathleen Hall",Public perceptions of AI science and scientists relatively more negative but less politicized than general and climate science,PNAS NEXUS,4,6,,,10.1093/pnasnexus/pgaf163,,Article,25-Jun,2025,"Using a weighted 2023-2025 national probability panel of US adults, we compared the perceived Credibility, Prudence, Unbiasedness, Self-Correction, and Benefit (i.e. Factors Assessing Science's Self-Presentation [FASS]) of AI scientists with those of scientists in general and climate scientists in particular. Our analysis reveals that respondents' composite perceptions of AI scientists are the most negative of the three, a difference driven by a facet of the Prudence factor, specifically the perception that AI science is causing unintended consequences; political ideology and patterns of media exposure are substantially more predictive of perceptions of climate science and science in general than of AI; and FASS and respondent ideology predict more variance in support for federal funding of the other two than of AI.",Human-AI Interaction and Perception,美国公众对AI科学家的总体感知较为负面，主要源于对不良后果的谨慎担忧，政治化程度低于气候科学。
"Alvarez, Amanda; Caliskan, Aylin; Crockett, M. J.; Ho, Shirley S.; Messeri, Lisa; West, Jevin",Science communication with generative AI,NATURE HUMAN BEHAVIOUR,,,,,10.1038/s41562-024-01846-3,24-Mar,Article; Early Access,,2024,"Generative AI tools can quickly translate or summarize large volumes of complex information. This technology could revolutionize the way that we communicate science, but there are many reasons for caution. We asked six experts about the potential and pitfalls of generative AI for science communication.",Applications in Professional and Scientific Fields,讨论生成式AI在科学传播中快速处理与翻译信息的潜力及其须谨慎对待的陷阱。
"Capraro, Valerio; Lentsch, Austin; Acemoglu, Daron; Akgun, Selin; Akhmedova, Aisel; Bilancini, Ennio; Bonnefon, Jean-Francois; Branas-Garza, Pablo; Butera, Luigi; Douglas, Karen M.; Everett, Jim A. C.; Gigerenzer, Gerd; Greenhow, Christine; Hashimoto, Daniel A.; Holt-Lunstad, Julianne; Jetten, Jolanda; Johnson, Simon; Kunz, Werner H.; Longoni, Chiara; Lunn, Pete; Natale, Simone; Paluch, Stefanie; Rahwan, Iyad; Selwyn, Neil; Singh, Vivek; Suri, Siddharth; Sutcliffe, Jennifer; Tomlinson, Joe; van der Linden, Sander; Van Lange, Paul A. M.; Wall, Friederike; Van Bavel, Jay J.; Viale, Riccardo",The impact of generative artificial intelligence on socioeconomic inequalities and policy making,PNAS NEXUS,3,6,,,10.1093/pnasnexus/pgae191,24-Jun,Review,JUN 11 2024,2024,"Generative artificial intelligence (AI) has the potential to both exacerbate and ameliorate existing socioeconomic inequalities. In this article, we provide a state-of-the-art interdisciplinary overview of the potential impacts of generative AI on (mis)information and three information-intensive domains: work, education, and healthcare. Our goal is to highlight how generative AI could worsen existing inequalities while illuminating how AI may help mitigate pervasive social problems. In the information domain, generative AI can democratize content creation and access but may dramatically expand the production and proliferation of misinformation. In the workplace, it can boost productivity and create new jobs, but the benefits will likely be distributed unevenly. In education, it offers personalized learning, but may widen the digital divide. In healthcare, it might improve diagnostics and accessibility, but could deepen pre-existing inequalities. In each section, we cover a specific topic, evaluate existing research, identify critical gaps, and recommend research directions, including explicit trade-offs that complicate the derivation of a priori hypotheses. We conclude with a section highlighting the role of policymaking to maximize generative AI's potential to reduce inequalities while mitigating its harmful effects. We discuss strengths and weaknesses of existing policy frameworks in the European Union, the United States, and the United Kingdom, observing that each fails to fully confront the socioeconomic challenges we have identified. We propose several concrete policies that could promote shared prosperity through the advancement of generative AI. This article emphasizes the need for interdisciplinary collaborations to understand and address the complex challenges of generative AI.","Bias, Ethics, and Societal Risks",综述生成式AI在信息、工作、教育与医疗中可能加剧或缓解不平等，并提出政策与研究方向。
"Feuerriegel, Stefan; Shrestha, Yash Raj; von Krogh, Georg; Zhang, Ce",Bringing artificial intelligence to business management,NATURE MACHINE INTELLIGENCE,4,7,611,613,10.1038/s42256-022-00512-5,,Editorial Material,22-Jul,2022,"Artificial intelligence (AI) can support managers by effectively delegating management decisions to AI. There are, however, many organizational and technical hurdles that need to be overcome, and we offer a first step on this journey by unpacking the core factors that may hinder or foster effective decision delegation to AI.",Applications in Professional and Scientific Fields,探讨将AI引入管理决策委派的可能性及相关组织与技术障碍，提出初步框架。
"Scully, Jackie Leach",Disability and AI: Much more than assistive technologies.,"Science (New York, N.Y.)",389,6762,eaea4918,eaea4918,10.1126/science.aea4918,,Journal Article,2025-Aug-21,2025,"Nothing succeeds like success, we are told, and certainly that seems true for artificial intelligence (AI). It is hard to overstate either the ubiquity or the success of AI-based technologies in science and technology, health research and care, the media, and everyday life.","Bias, Ethics, and Societal Risks",阐述AI与残障议题的广泛关联，强调研究与政策应超越仅限辅助技术的视角。
"Piao, Jinghua; Liu, Jiazhen; Zhang, Fang; Su, Jun; Li, Yong",Human-AI adaptive dynamics drives the emergence of information cocoons,NATURE MACHINE INTELLIGENCE,5,11,1214,1224,10.1038/s42256-023-00731-4,23-Oct,Article,23-Nov,2023,"Despite AI-driven recommendation algorithms being widely adopted to counter information overload, substantial evidence suggests that they are building cocoons of homogeneous contents and viewpoints, further aggravating social polarization and prejudice. Curbing these perils requires a deep insight into the origin of information cocoons. Here we investigate information cocoons in the real world using two large datasets and find that a large number of users are trapped in information cocoons. Further empirical analysis suggests that two ingredients, each corresponding to a fundamental mechanism in human-AI interaction systems, are correlated with the loss of information diversity. Grounded on the empirical findings, we derive a mechanistic model for the adaptive information dynamics in complex human-AI interaction systems governed by these fundamental mechanisms. It allows us to predict critical transitions between three states: diversification, partial information cocoons, and deep information cocoons. Our work not only empirically traces real-world information cocoons in two representative scenarios, but also theoretically unearths basic mechanisms governing the emergence of information cocoons. We provide a theoretical method for understanding major social issues resulting from adaptive information dynamics in complex human-AI interaction systems.It is widely known that AI-based recommendation systems on social media and news websites can isolate humans from diverse information, eventually trapping them in so-called information cocoons, where they are exposed to a narrow range of viewpoints. Li et al. introduce an adaptive information dynamics model to uncover the origin of information cocoons in complex human-AI interaction systems, and test their findings on two large real-world datasets.",Impact on Human Cognition and Collective Intelligence,基于实证与模型揭示人机自适应互动如何导致信息茧房的形成及其关键转变机制。
"Ahsen, Mehmet Eren; Ayvaci, Mehmet U. S.; Mookerjee, Radha; Stolovitzky, Gustavo",Economics of AI and human task sharing for decision making in screening mammography,NATURE COMMUNICATIONS,16,1,,,10.1038/s41467-025-57409-1,,Article,MAR 7 2025,2025,"The rising global incidence of breast cancer and the persistent shortage of specialized radiologists have heightened the demand for innovative solutions in mammography screening. Artificial intelligence (AI) has emerged as a promising tool to bridge this demand-supply gap, with potential applications ranging from full automation to integrated AI-human decision-making. This study evaluates the economic feasibility of incorporating artificial intelligence (AI) into mammography screening within healthcare settings, considering full or partial integration. To evaluate the economic viability, we employ an optimization model specifically designed to minimize mammography screening costs. This model considers three distinct approaches when interpreting mammograms: automation strategy utilizing AI exclusively, delegation strategy involving the selective allocation of tasks between radiologists and AI, and the expert-alone strategy relying solely on radiologist decisions. Our findings underscore the significance of disease prevalence in relation to the trade-off between costs associated with false positives (e.g., follow-up expenses) and false negatives (e.g., litigation costs stemming from missed diagnoses) in shaping the AI strategy for healthcare organizations. We backtest our approach using data from an AI contest in which participants aimed to match or surpass radiologists' performance in assessing screening mammograms for women. The contest data supports the optimality of the delegation strategy, potentially leading to cost savings of 17.5% to 30.1% compared to relying solely on human experts. Our research provides guidance for healthcare organizations considering AI integration in mammography screening, with broader implications for work design and human-AI hybrid solutions in various fields.",Applications in Professional and Scientific Fields,通过优化模型评估AI在乳腺筛查中不同人机任务分配策略，发现委派策略能显著降低成本。
"McKee, Kevin R.; Botvinick, Matthew",AI learns to encourage group cooperation by making new connections,NATURE HUMAN BEHAVIOUR,7,10,1618,1619,10.1038/s41562-023-01699-2,23-Sep,Editorial Material,23-Oct,2023,"We trained an artificial intelligence (AI) system to recommend different interactions and connections between humans playing a group game together. Through trial and error, the AI system learned to take an encouraging approach to uncooperative individuals, keeping them engaged with the group and boosting cooperation levels for everyone.",Impact on Human Cognition and Collective Intelligence,训练AI通过建议新的社交连接来鼓励不合作者参与，从而整体提升群体合作水平。
"Wittenberg, Chloe; Epstein, Ziv; Peloquin-Skulski, Gabrielle; Berinsky, Adam J.; Rand, David G.",Labeling AI-generated media online,PNAS NEXUS,4,6,,,10.1093/pnasnexus/pgaf170,,Article,25-Jun,2025,"Recent advancements in generative AI have raised widespread concern about the use of this technology to spread audio and visual misinformation. In response, there has been a major push among policymakers and technology companies to label AI-generated media appearing online. It remains unclear, however, what types of labels are most effective for this purpose. Here, we evaluate two (potentially complementary) strategies for labeling AI-generated content online: (i) a process-based approach, aimed at clarifying how content was made and (ii) a harm-based approach, aimed at highlighting content's potential to mislead. Using two preregistered survey experiments focused on misleading, AI-generated images (total n = 7,579 Americans), we assess the consequences of these different labeling strategies for viewers' beliefs and behavioral intentions. Overall, we find that all of the labels we tested significantly decreased participants' belief in the presented claims. However, in both studies, labels that simply informed participants that content was generated using AI tended to have little impact on respondents' stated likelihood of engaging with their assigned post. Together, these results shed light on the relative advantages and disadvantages of different approaches to labeling AI-generated media online.",Content Authenticity and Mitigation Strategies,比较不同AI生成媒体标注策略对受众信念与行为意向的影响，发现标注可降低信任但对参与意愿影响有限。
"Messeri, Lisa; Crockett, M. J.",Artificial intelligence and illusions of understanding in scientific research,NATURE,627,8002,49,58,10.1038/s41586-024-07146-0,,Review,MAR 7 2024,2024,"Scientists are enthusiastically imagining ways in which artificial intelligence (AI) tools might improve research. Why are AI tools so attractive and what are the risks of implementing them across the research pipeline? Here we develop a taxonomy of scientists' visions for AI, observing that their appeal comes from promises to improve productivity and objectivity by overcoming human shortcomings. But proposed AI solutions can also exploit our cognitive limitations, making us vulnerable to illusions of understanding in which we believe we understand more about the world than we actually do. Such illusions obscure the scientific community's ability to see the formation of scientific monocultures, in which some types of methods, questions and viewpoints come to dominate alternative approaches, making science less innovative and more vulnerable to errors. The proliferation of AI tools in science risks introducing a phase of scientific enquiry in which we produce more but understand less. By analysing the appeal of these tools, we provide a framework for advancing discussions of responsible knowledge production in the age of AI.The proliferation of artificial intelligence tools in scientific research risks creating illusions of understanding, where scientists believe they understand more about the world than they actually do.",Impact on Human Cognition and Collective Intelligence,AI在科研中可能造成理解幻象，促成方法单一化并削弱创新。
"Purcell, Zoe A.; Bonnefon, Jean-Francois",Humans feel too special for machines to score their morals,PNAS NEXUS,2,6,,,10.1093/pnasnexus/pgad179,23-Jun,Article,MAY 31 2023,2023,"Artificial intelligence (AI) can be harnessed to create sophisticated social and moral scoring systems-enabling people and organizations to form judgments of others at scale. However, it also poses significant ethical challenges and is, subsequently, the subject of wide debate. As these technologies are developed and governing bodies face regulatory decisions, it is crucial that we understand the attraction or resistance that people have for AI moral scoring. Across four experiments, we show that the acceptability of moral scoring by AI is related to expectations about the quality of those scores, but that expectations about quality are compromised by people's tendency to see themselves as morally peculiar. We demonstrate that people overestimate the peculiarity of their moral profile, believe that AI will neglect this peculiarity, and resist for this reason the introduction of moral scoring by AI.",Human-AI Interaction and Perception,人们因自认为道德独特而对AI道德评分持抵触态度。
