Authors,ArticleTitle,Source Title,Volume,Issue,Start Page,End Page,DOI,Early Access Date,Document Type,Publication Date,Publication Year,Abstract,N,O
"Nussberger, Anne-Marie; Luo, Lan; Celis, L. Elisa; Crockett, M. J.",Public attitudes value interpretability but prioritize accuracy in Artificial Intelligence,NATURE COMMUNICATIONS,13,1,,,10.1038/s41467-022-33417-3,,Article,OCT 3 2022,2022,"As Artificial Intelligence (AI) proliferates across important social institutions, many of the most powerful AI systems available are difficult to interpret for end-users and engineers alike. Here, we sought to characterize public attitudes towards AI interpretability. Across seven studies (N = 2475), we demonstrate robust and positive attitudes towards interpretable AI among non-experts that generalize across a variety of real-world applications and follow predictable patterns. Participants value interpretability positively across different levels of AI autonomy and accuracy, and rate interpretability as more important for AI decisions involving high stakes and scarce resources. Crucially, when AI interpretability trades off against AI accuracy, participants prioritize accuracy over interpretability under the same conditions driving positive attitudes towards interpretability in the first place: amidst high stakes and scarce resources. These attitudes could drive a proliferation of AI systems making high-impact ethical decisions that are difficult to explain and understand.For many AI systems, it is hard to interpret how they make decisions. Here, the authors show that non-experts value interpretability in AI, especially for decisions involving high stakes and scarce resources, but they sacrifice AI interpretability when it trades off against AI accuracy.",Human-AI Interaction and Perception,公众普遍重视AI可解释性但在可解释性与准确性冲突时宁可优先准确性，尤其在高风险情境。
"Ilievski, Filip; Hammer, Barbara; van Harmelen, Frank; Paassen, Benjamin; Saralajew, Sascha; Schmid, Ute; Biehl, Michael; Bolognesi, Marianna; Dong, Xin Luna; Gashteovski, Kiril; Hitzler, Pascal; Marra, Giuseppe; Minervini, Pasquale; Mundt, Martin; Ngomo, Axel-Cyrille Ngonga; Oltramari, Alessandro; Pasi, Gabriella; Saribatur, Zeynep G.; Serafini, Luciano; Shawe-Taylor, John; Shwartz, Vered; Skitalinskaya, Gabriella; Stachl, Clemens; van de Ven, Gido M.; Villmann, Thomas",Aligning generalization between humans and machines,NATURE MACHINE INTELLIGENCE,7,9,1378,1389,10.1038/s42256-025-01109-4,25-Sep,Review,25-Sep,2025,"Recent advances in artificial intelligence (AI)-including generative approaches-have resulted in technology that can support humans in scientific discovery and forming decisions, but may also disrupt democracies and target individuals. The responsible use of AI and its participation in human-AI teams increasingly shows the need for AI alignment, that is, to make AI systems act according to our preferences. A crucial yet often overlooked aspect of these interactions is the different ways in which humans and machines generalize. In cognitive science, human generalization commonly involves abstraction and concept learning. By contrast, AI generalization encompasses out-of-domain generalization in machine learning, rule-based reasoning in symbolic AI, and abstraction in neurosymbolic AI. Here we combine insights from AI and cognitive science to identify key commonalities and differences across three dimensions: notions of, methods for, and evaluation of generalization. We map the different conceptualizations of generalization in AI and cognitive science along these three dimensions and consider their role for alignment in human-AI teaming. This results in interdisciplinary challenges across AI and cognitive science that must be tackled to support effective and cognitively supported alignment in human-AI teaming scenarios.",Human-AI Interaction and Perception,对比人类与机器的泛化方式，探讨三维框架下的对齐挑战以改进人机协同。
"Altay, Sacha; Gilardi, Fabrizio","People are skeptical of headlines labeled as AI-generated, even if true or human-made, because they assume full AI automation",PNAS NEXUS,3,10,,,10.1093/pnasnexus/pgae403,,Article,OCT 1 2024,2024,"The rise of generative AI tools has sparked debates about the labeling of AI-generated content. Yet, the impact of such labels remains uncertain. In two preregistered online experiments among US and UK participants (N = 4,976), we show that while participants did not equate AI-generated with False, labeling headlines as AI-generated lowered their perceived accuracy and participants' willingness to share them, regardless of whether the headlines were true or false, and created by humans or AI. The impact of labeling headlines as AI-generated was three times smaller than labeling them as false. This AI aversion is due to expectations that headlines labeled as AI-generated have been entirely written by AI with no human supervision. These findings suggest that the labeling of AI-generated content should be approached cautiously to avoid unintended negative effects on harmless or even beneficial AI-generated content and that effective deployment of labels requires transparency regarding their meaning.",Content Authenticity and Mitigation Strategies,将标题标注为“AI生成”会降低公众对其准确性的判断与分享意愿，因人们假设完全由AI自动化完成。
"Gao, Jian; Wang, Dashun",Quantifying the use and potential benefits of artificial intelligence in scientific research,NATURE HUMAN BEHAVIOUR,8,12,,,10.1038/s41562-024-02020-5,24-Oct,Article,24-Dec,2024,"The rapid advancement of artificial intelligence (AI) is poised to reshape almost every line of work. Despite enormous efforts devoted to understanding AI's economic impacts, we lack a systematic understanding of the benefits to scientific research associated with the use of AI. Here we develop a measurement framework to estimate the direct use of AI and associated benefits in science. We find that the use and benefits of AI appear widespread throughout the sciences, growing especially rapidly since 2015. However, there is a substantial gap between AI education and its application in research, highlighting a misalignment between AI expertise supply and demand. Our analysis also reveals demographic disparities, with disciplines with higher proportions of women or Black scientists reaping fewer benefits from AI, potentially exacerbating existing inequalities in science. These findings have implications for the equity and sustainability of the research enterprise, especially as the integration of AI with science continues to deepen.Gao and Wang develop a measurement framework that demonstrates the widespread use and benefits of AI in science. Nonetheless, there is a substantial gap between AI education and application across disciplines.",Applications in Professional and Scientific Fields,构建测量框架表明AI在科学研究中的应用与益处广泛且增长迅速，但AI教育与实务脱节且存在人口学差距。
"Choi, Sukwoong; Kang, Hyo; Kim, Namil; Kim, Junsik",The dual edges of AI: Advancing knowledge while reducing diversity,PNAS NEXUS,4,5,,,10.1093/pnasnexus/pgaf138,,Article,25-May,2025,"We study how the interaction between human professionals and AI in advancing knowledge, using professional Go matches from 2003 to 2021. In 2017, an AI-powered Go program (APG) far surpassed the best human player, and professional players began learning from AI. Such human-AI interaction paved a new way to reassess historical Go knowledge and create new knowledge. We analyze standard patterns (defined as a sequence of the first eight alternating moves) in about 15 million moves by over 1,700 players in nearly 70,000 professional Go games and find that, after APG, professional players significantly changed how they adopted different sets of moves. However, new knowledge catalyzed by AI comes at the expense of a reduced diversity in moves. Further, AI's impact on knowledge creation is greater for highly skilled players; since AI does not explain, learning from AI requires the absorptive capacity of the top professionals.",Impact on Human Cognition and Collective Intelligence,围绕围棋职业赛数据发现自AI出现后高水平选手采纳新走法并推动知识革新，但总体棋路多样性下降。
"Wang, Ge; Zhao, Jun; Van Kleek, Max; Shadbolt, Nigel",Challenges and opportunities in translating ethical AI principles into practice for children,NATURE MACHINE INTELLIGENCE,6,3,265,270,10.1038/s42256-024-00805-x,,Review,24-Mar,2024,"AI systems are becoming increasingly pervasive within children's devices, apps and services. The concern over a world where AI systems are deployed unchecked has raised burning questions about the impact, governance and accountability of these technologies. Although recent effort on AI ethics has converged into growing consensus on a set of high-level ethical AI principles, engagement with children's issues is still limited, and even less is known about how to effectively apply them in practice for children. This Perspective first maps the current global landscape of existing ethics guidelines for AI and analyses their correlation with children. We then critically assess the strategies and recommendations proposed by current AI ethics initiatives, identifying the critical challenges in translating such ethical AI principles into practice for children. Finally, we tentatively map out several suggestions regarding embedding ethics into the development and governance of AI for children.As the impacts of AI on everyday life increase, guidelines are needed to ensure ethical deployment and use of this technology. This is even more pressing for technology that interacts with groups that need special protection, such as children. In this Perspective Wang et al. survey the existing AI ethics guidelines with a focus on children's issues, and provide suggestions for further development.","Bias, Ethics, and Societal Risks",评估现有AI伦理指南在儿童场景中的适用性，指出将伦理原则落地于儿童技术中的挑战与建议。
"Koebis, Nils; Starke, Christopher; Rahwan, Iyad",The promise and perils of using artificial intelligence to fight corruption,NATURE MACHINE INTELLIGENCE,4,5,418,424,10.1038/s42256-022-00489-1,22-May,Article,22-May,2022,"Despite the growing number of initiatives that employ AI to counter corruption, few studies empirically tackle the political and social consequences of embedding AI in anti-corruption efforts. The authors outline the societal and technical challenges that need to be overcome for AI to fight corruption.Corruption presents one of the biggest challenges of our time, and much hope is placed in artificial intelligence (AI) to combat it. Although the growing number of AI-based anti-corruption tools (AI-ACT) have been summarized, a critical examination of their promises and perils is lacking. Here we argue that the success of AI-ACT strongly depends on whether they are implemented top-down (by governments) or bottom-up (by citizens, non-governmental organizations or journalists). Top-down use of AI-ACT can consolidate power structures and thereby pose new corruption risks. Bottom-up use of AI-ACT has the potential to provide unprecedented means for the citizenry to keep their government and bureaucratic officials in check. We outline the societal and technical challenges that need to be overcome to harness the potential for AI to fight corruption.","Bias, Ethics, and Societal Risks",分析AI反腐工具的社会与技术挑战，指出自上而下可能加固权力而自下而上可增强公民监督。
"Vaccaro, Michelle; Almaatouq, Abdullah; Malone, Thomas",When combinations of humans and AI are useful: A systematic review and meta-analysis,NATURE HUMAN BEHAVIOUR,8,12,,,10.1038/s41562-024-02024-1,24-Oct,Article,24-Dec,2024,"Inspired by the increasing use of artificial intelligence (AI) to augment humans, researchers have studied human-AI systems involving different tasks, systems and populations. Despite such a large body of work, we lack a broad conceptual understanding of when combinations of humans and AI are better than either alone. Here we addressed this question by conducting a preregistered systematic review and meta-analysis of 106 experimental studies reporting 370 effect sizes. We searched an interdisciplinary set of databases (the Association for Computing Machinery Digital Library, the Web of Science and the Association for Information Systems eLibrary) for studies published between 1 January 2020 and 30 June 2023. Each study was required to include an original human-participants experiment that evaluated the performance of humans alone, AI alone and human-AI combinations. First, we found that, on average, human-AI combinations performed significantly worse than the best of humans or AI alone (Hedges' g = -0.23; 95% confidence interval, -0.39 to -0.07). Second, we found performance losses in tasks that involved making decisions and significantly greater gains in tasks that involved creating content. Finally, when humans outperformed AI alone, we found performance gains in the combination, but when AI outperformed humans alone, we found losses. Limitations of the evidence assessed here include possible publication bias and variations in the study designs analysed. Overall, these findings highlight the heterogeneity of the effects of human-AI collaboration and point to promising avenues for improving human-AI systems.Vaccaro et al. present a systematic review and meta-analysis of the performance of human-AI combinations, finding that on average, human-AI combinations performed significantly worse than the best of humans or AI alone. They also found performance losses in decision-making tasks and significantly greater gains in content creation tasks.",Impact on Human Cognition and Collective Intelligence,元分析显示人机组合总体不及最佳单一方，决策类任务表现下降而内容创造类任务能获显著提升。
"Zhou, Eric; Lee, Dokyun","Generative artificial intelligence, human creativity, and art",PNAS NEXUS,3,3,,,10.1093/pnasnexus/pgae052,24-Mar,Article,FEB 29 2024,2024,"Recent artificial intelligence (AI) tools have demonstrated the ability to produce outputs traditionally considered creative. One such system is text-to-image generative AI (e.g. Midjourney, Stable Diffusion, DALL-E), which automates humans' artistic execution to generate digital artworks. Utilizing a dataset of over 4 million artworks from more than 50,000 unique users, our research shows that over time, text-to-image AI significantly enhances human creative productivity by 25% and increases the value as measured by the likelihood of receiving a favorite per view by 50%. While peak artwork Content Novelty, defined as focal subject matter and relations, increases over time, average Content Novelty declines, suggesting an expanding but inefficient idea space. Additionally, there is a consistent reduction in both peak and average Visual Novelty, captured by pixel-level stylistic elements. Importantly, AI-assisted artists who can successfully explore more novel ideas, regardless of their prior originality, may produce artworks that their peers evaluate more favorably. Lastly, AI adoption decreased value capture (favorites earned) concentration among adopters. The results suggest that ideation and filtering are likely necessary skills in the text-to-image process, thus giving rise to generative synesthesia-the harmonious blending of human exploration and AI exploitation to discover new creative workflows.",Impact on Human Cognition and Collective Intelligence,大规模文本图像生成AI提升艺术家创作产量与作品受欢迎度，但视觉风格新颖性总体下降需掌握构思与筛选技能。
"Glickman, Moshe; Sharot, Tali","How human-AI feedback loops alter human perceptual, emotional and social judgements",NATURE HUMAN BEHAVIOUR,9,2,,,10.1038/s41562-024-02077-2,24-Dec,Article,25-Feb,2025,"Artificial intelligence (AI) technologies are rapidly advancing, enhancing human capabilities across various fields spanning from finance to medicine. Despite their numerous advantages, AI systems can exhibit biased judgements in domains ranging from perception to emotion. Here, in a series of experiments (n = 1,401 participants), we reveal a feedback loop where human-AI interactions alter processes underlying human perceptual, emotional and social judgements, subsequently amplifying biases in humans. This amplification is significantly greater than that observed in interactions between humans, due to both the tendency of AI systems to amplify biases and the way humans perceive AI systems. Participants are often unaware of the extent of the AI's influence, rendering them more susceptible to it. These findings uncover a mechanism wherein AI systems amplify biases, which are further internalized by humans, triggering a snowball effect where small errors in judgement escalate into much larger ones.",Impact on Human Cognition and Collective Intelligence,实验表明人-AI反馈循环会改变人的感知、情绪和社交判断，并放大偏见，且人们常不自觉受AI影响。
"Summerfield, Christopher; Argyle, Lisa P.; Bakker, Michiel; Collins, Teddy; Durmus, Esin; Eloundou, Tyna; Gabriel, Iason; Ganguli, Deep; Hackenburg, Kobi; Hadfield, Gillian K.; Hewitt, Luke; Huang, Saffron; Landemore, Helene; Marchal, Nahema; Ovadya, Aviv; Procaccia, Ariel; Risse, Mathias; Schneier, Bruce; Seger, Elizabeth; Siddarth, Divya; Skaug Saetra, Henrik; Tessler, Michael Henry; Botvinick, Matthew",The impact of advanced AI systems on democracy,NATURE HUMAN BEHAVIOUR,,,,,10.1038/s41562-025-02309-z,25-Oct,Review; Early Access,,2025,"Advanced artificial intelligence (AI) systems capable of generating humanlike text and multimodal content are now widely available. Here we ask what impact this will have on the democratic process. We consider the consequences of AI for citizens' ability to make educated and competent choices about political representatives and issues (epistemic impacts). We explore how AI might be used to destabilize or support the mechanisms, including elections, by which democracy is implemented (material impacts). Finally, we discuss whether AI will strengthen or weaken the principles on which democracy is based (foundational impacts). The arrival of new AI systems clearly poses substantial challenges for democracy. However, we argue that AI systems also offer new opportunities to educate and learn from citizens, strengthen public discourse, help people to find common ground, and reimagine how democracies might work better.","Bias, Ethics, and Societal Risks",评估先进AI对民主的认知、物质与基础性影响，认为AI既带来挑战也提供改善公共话语与参与的机会。
"DeCamp, Matthew; Lindvall, Charlotta",Mitigating bias in AI at the point of care,SCIENCE,381,6654,150,152,10.1126/science.adh2713,,Editorial Material,JUL 14 2023,2023,"Artificial intelligence (AI) shows promise for improving basic and translational science, medicine, and public health, but its success is not guaranteed. Numerous examples have arisen of racial, ethnic, gender, disability, and other biases in AI applications to health care. In ethics, bias generally refers to any systematic, unfair favoring of people in terms of how they are treated or the outcomes they experience. Consensus has emerged among scientists, ethicists, and policy-makers that minimizing bias is a shared responsibility among all involved in AI development. For example, ensuring equity by eliminating bias in AI is a core principle of the World Health Organization for governing AI (1). But ensuring equity will require more than unbiased data and algorithms. It will also require reducing biases in how clinicians and patients use AI-based algorithms-a potentially more challenging task than reducing biases in algorithms themselves.","Bias, Ethics, and Societal Risks",讨论医疗场景中AI偏见问题，强调消除偏见需在数据、算法与临床使用中共同承担责任。
"Sharma, Ashish; Lin, Inna W.; Miner, Adam S.; Atkins, David C.; Althoff, Tim",Human-AI collaboration enables more empathic conversations in text-based peer-to-peer mental health support,NATURE MACHINE INTELLIGENCE,5,1,46,57,10.1038/s42256-022-00593-2,,Article,23-Jan,2023,"Advances in artificial intelligence (AI) are enabling systems that augment and collaborate with humans to perform simple, mechanistic tasks such as scheduling meetings and grammar-checking text. However, such human-AI collaboration poses challenges for more complex tasks, such as carrying out empathic conversations, due to the difficulties that AI systems face in navigating complex human emotions and the open-ended nature of these tasks. Here we focus on peer-to-peer mental health support, a setting in which empathy is critical for success, and examine how AI can collaborate with humans to facilitate peer empathy during textual, online supportive conversations. We develop HAILEY, an AI-in-the-loop agent that provides just-in-time feedback to help participants who provide support (peer supporters) respond more empathically to those seeking help (support seekers). We evaluate HAILEY in a non-clinical randomized controlled trial with real-world peer supporters on TalkLife (N = 300), a large online peer-to-peer support platform. We show that our human-AI collaboration approach leads to a 19.6% increase in conversational empathy between peers overall. Furthermore, we find a larger, 38.9% increase in empathy within the subsample of peer supporters who self-identify as experiencing difficulty providing support. We systematically analyse the human-AI collaboration patterns and find that peer supporters are able to use the AI feedback both directly and indirectly without becoming overly reliant on AI while reporting improved self-efficacy post-feedback. Our findings demonstrate the potential of feedback-driven, AI-in-the-loop writing systems to empower humans in open-ended, social and high-stakes tasks such as empathic conversations.AI language modelling and generation approaches have developed fast in the last decade, opening promising new directions in human-AI collaboration. An AI-in-the loop conversational system called HAILEY is developed to empower peer supporters in providing empathic responses to mental health support seekers.",Human-AI Interaction and Perception,AI实时反馈系统HAILEY在在线互助心理支持中提升了同理心表达，尤其对难以提供支持者效果显著。
"Lee, Doyeon; Pruitt, Joseph; Zhou, Tianyu; Du, Jing; Odegaard, Brian",Metacognitive sensitivity: The key to calibrating trust and optimal decision making with AI,PNAS NEXUS,4,5,,,10.1093/pnasnexus/pgaf133,,Article,25-May,2025,"Knowing when to trust and incorporate the advice from artificially intelligent (AI) systems is of increasing importance in the modern world. Research indicates that when AI provides high confidence ratings, human users often correspondingly increase their trust in such judgments, but these increases in trust can occur even when AI fails to provide accurate information on a given task. In this piece, we argue that measures of metacognitive sensitivity provided by AI systems will likely play a critical role in (1) helping individuals to calibrate their level of trust in these systems and (2) optimally incorporating advice from AI into human-AI hybrid decision making. We draw upon a seminal finding in the perceptual decision-making literature that demonstrates the importance of metacognitive ratings for optimal joint decisions and outline a framework to test how different types of information provided by AI systems can guide decision making.",Impact on Human Cognition and Collective Intelligence,提出利用AI提供的元认知敏感性信息来校准人类对AI的信任并优化人机联合决策。
"Feuerriegel, Stefan; DiRresta, Renee; Goldstein, Josh A.; Kumar, Srijan; Lorenz-Spreen, Philipp; Tomz, Michael; Proellochs, Nicolas",Research can help to tackle AI-generated disinformation,NATURE HUMAN BEHAVIOUR,,,,,10.1038/s41562-023-01726-2,23-Nov,Editorial Material; Early Access,,2023,Generative artificial intelligence (AI) tools have made it easy to create realistic disinformation that is hard to detect by humans and may undermine public trust. Some approaches used for assessing the reliability of online information may no longer work in the AI age. We offer suggestions for how research can help to tackle the threats of AI-generated disinformation.,Content Authenticity and Mitigation Strategies,论述如何通过研究应对难以识别的AI生成虚假信息并提出应对建议。
